{
  "id": "musopen-ensemble",
  "name_ru": "Musopen Kickstarter Ensemble",
  "name_en": "Musopen Kickstarter Ensemble",
  "kind": "ensemble",
  "summary_ru": "Профессиональные музыканты и оркестры, нанятые Musopen в 2010–2012 через Kickstarter для студийных записей классики в общественное достояние. Около 145 произведений; конкретный состав менялся: камерные ансамбли для квартетов, оркестры для симфоний.",
  "photo_license": "PD",
  "source": "https://musopen.org/about/"
}
